{
  "protocol_version": "0.1",
  "id": "tsk_demo0000000000000001",
  "contract_revision": 1,
  "goal": "Reassign issue 1001 to bob",
  "owner": "agent@example-project.iam.gserviceaccount.com",
  "grant_id": "grt_demo0000000000000001",
  "scope": {
    "actions": [
      "issues.update_owner"
    ],
    "resources": [
      "issue://issue-tracker/issues/*"
    ]
  },
  "requirements": [
    {
      "id": "req_owner",
      "text": "Issue 1001 must be owned by bob",
      "provenance": "user"
    }
  ],
  "assumptions": [
    {
      "id": "asm_exists",
      "text": "Issue 1001 exists and is open",
      "provenance": "agent"
    }
  ],
  "required_checks": [
    {
      "id": "owner_matches",
      "method": "read_back",
      "verifier_id": "http.readback",
      "target": "issue://issue-tracker/issues/{args.issue_id}",
      "predicate": {
        "op": "eq",
        "path": "/owner",
        "value": "bob"
      },
      "scope": "single",
      "freshness": {
        "max_age_seconds": 3600
      },
      "deadline_seconds": 10,
      "provenance": "user"
    }
  ],
  "created_at": "2026-10-22T14:00:00.000Z",
  "revised_at": "2026-10-22T14:00:00.000Z"
}
